Column Name,Sample Entry,Label,Type,Description,Keywords
IMWDUM,"Discrete values:   , M3, MM, SZ",Width UOM,String,"Unit of measure for width. Values: M3, MM, SZ.",width; uom; unit; measure; dimension
IMHIGH,"Discrete values: 0.0, 0.18",Height,Decimal,"Height dimension. Values: 0.0, 0.18.",height; dimension; size; measure; physical
IMHUOM,"Discrete values:   , M3",Height UOM,String,Unit of measure for height. Values: M3.,height; uom; unit; measure; dimension
IMFLPC,"Lots of 0's (75.1%), Range from 0.0 to 2.8, Contains decimal values",Floor Percentage,Decimal,Floor percentage. Ranges from 0.0 to 2.8.,floor; percentage; measure; space; ratio
IMFLPF,"Lots of 0's (60.9%), Range from 0.0 to 315.0, Contains decimal values",Floor Factor,Decimal,Floor factor. Ranges from 0.0 to 315.0.,floor; factor; measure; space; ratio
IMRFPK,"Discrete values: 0, 1, 2, 4, 5",Ref Pack,Integer,"Reference pack. Values: 0, 1, 2, 4, 5.",ref; pack; reference; packaging; code
IMLTTM,Constant value of '0' for all entries,Lot Time,Flag,Lot time. Constant value '0'.,lot; time; zero; unused; production
IMCCTM,Constant value of '0' for all entries,Cost Change Time,Flag,Cost change time. Constant value '0'.,cost; change; time; zero; unused
IMLPGM,Discrete values:  either MRP140D2  or blank,Last Program,String,"Last program used. Values: MRP140D2, blank.",program; last; system; update; source
IMECST,Constant value of '0' for all entries,Estimated Cost,Flag,Estimated cost. Constant value '0'.,estimated; cost; zero; unused; financial
IMABRV,"Text/Mixed data. 30 unique values. Samples: PRPAP2         , PRALL          , PRPAP2         , PRALL          , SALFS          ",Abbreviation,String,"Abbreviation code used for accounting. Samples: PRPAP2, PRALL, SALFS. | [BPCS Docs]: CMS abbreviation – USED FOR ACCOUNTING!!!",abbreviation; code; short; text; name
IMMFMD,Constant value of '1' for all entries,Mfg Mode,Flag,Manufacturing mode. Constant value '1'.,mfg; mode; manufacturing; flag; type
IMGSOR,Constant value of '0' for all entries,Gross Source,Flag,Gross source. Constant value '0'.,gross; source; zero; unused; planning
IMALRQ,"Discrete values: 0, 1",Allocated Req,Integer,"Allocated requirement. Values: 0, 1.",allocated; req; requirement; planning; flag
IMBRGC,"Discrete values:   , BK, CI, MC, MW, SB, SE, TC, YU",Bridge Code,String,"Bridge code. Values: BK, CI, MC, MW, etc.",bridge; code; type; classification; system
IMLDTE,Constant value of '0' for all entries,Lot Date,Flag,Lot date. Constant value '0'.,lot; date; zero; unused; production
IMLTME,Constant value of '0' for all entries,Lot Time,Flag,Lot time. Constant value '0'.,lot; time; zero; unused; production
IMATPA,"Discrete values: 0, 1",ATP Allowed,Integer,"ATP allowed flag. Values: 0, 1.",atp; allowed; flag; planning; promise
IMCIOQ,Constant value of '0' for all entries,Cumulative IOQ,Flag,Cumulative IOQ. Constant value '0'.,cumulative; ioq; zero; unused; quantity
IMCMOQ,Constant value of '0' for all entries,Cumulative MOQ,Flag,Cumulative MOQ. Constant value '0'.,cumulative; moq; zero; unused; quantity
IMCSOQ,Constant value of '0' for all entries,Cumulative SOQ,Flag,Cumulative SOQ. Constant value '0'.,cumulative; soq; zero; unused; quantity
IMUMPC,Constant value of '1' for all entries,UOM Pack Code,Flag,UOM pack code. Constant value '1'.,uom; pack; code; flag; unit
IMUMPR,"Discrete values: EA, FT, HD, KG, KP, L , M , SZ, TH",UOM Price,String,"Unit of measure for pricing. Values: EA, FT, KG, etc.",uom; price; unit; measure; cost
IMEXBS,"Discrete values:  , 1",Expense Base,Integer,"Expense base. Values: blank, 1.",expense; base; financial; code; type
IMSLHR,Constant value of '0' for all entries,Shelf Life Hours,Flag,Shelf life in hours. Constant value '0'.,shelf; life; hours; zero; unused
IMRTHR,Constant value of '0' for all entries,Retention Hours,Flag,Retention hours. Constant value '0'.,retention; hours; zero; unused; storage
